{
  "$schema": "https://json-schema.org/draft/2020-12/schema", "$id": "urn:quantiqmt:event:market.bar_closed:v1", "title": "MarketBarClosedPayloadV1",
  "type": "object", "additionalProperties": false,
  "required": ["event_id", "partition_key", "provider", "instrument_id", "exchange", "calendar_id", "calendar_version", "session_id", "trading_day", "session_open_at", "session_close_at", "timeframe_seconds", "allowed_lateness_ms", "window_start", "window_end", "event_time", "received_at", "watermark_event_time", "open", "high", "low", "close", "volume", "turnover", "source_sequence_start", "source_sequence_end", "watermark_sequence", "quality", "gap_start_sequence", "gap_end_sequence", "partial", "final", "revision", "aggregation_policy_version", "content_checksum"],
  "properties": {
    "event_id": {"type": "string", "format": "uuid", "pattern": "^[0-9a-f-]{36}$"}, "partition_key": {"type": "string", "minLength": 1, "maxLength": 64}, "provider": {"type": "string", "minLength": 1, "maxLength": 64}, "instrument_id": {"type": "string", "minLength": 1, "maxLength": 64}, "exchange": {"type": "string", "pattern": "^[A-Z0-9]{2,16}$"},
    "calendar_id": {"type": "string", "minLength": 1}, "calendar_version": {"type": "string", "minLength": 1}, "session_id": {"type": "string", "minLength": 1}, "trading_day": {"type": "string", "format": "date"}, "session_open_at": {"type": "string", "format": "date-time", "pattern": "Z$"}, "session_close_at": {"type": "string", "format": "date-time", "pattern": "Z$"},
    "timeframe_seconds": {"type": "integer", "minimum": 1, "maximum": 86400}, "allowed_lateness_ms": {"type": "integer", "minimum": 0, "maximum": 60000}, "window_start": {"type": "string", "format": "date-time", "pattern": "Z$"}, "window_end": {"type": "string", "format": "date-time", "pattern": "Z$"}, "event_time": {"type": "string", "format": "date-time", "pattern": "Z$"}, "received_at": {"type": "string", "format": "date-time", "pattern": "Z$"}, "watermark_event_time": {"type": "string", "format": "date-time", "pattern": "Z$"},
    "open": {"type": "string", "pattern": "^(?=.*[1-9])(0|[1-9][0-9]{0,17})(\\.[0-9]{1,8})?$"}, "high": {"type": "string", "pattern": "^(?=.*[1-9])(0|[1-9][0-9]{0,17})(\\.[0-9]{1,8})?$"}, "low": {"type": "string", "pattern": "^(?=.*[1-9])(0|[1-9][0-9]{0,17})(\\.[0-9]{1,8})?$"}, "close": {"type": "string", "pattern": "^(?=.*[1-9])(0|[1-9][0-9]{0,17})(\\.[0-9]{1,8})?$"}, "volume": {"type": "integer", "minimum": 0, "maximum": 9007199254740991}, "turnover": {"type": "string", "pattern": "^(0|[1-9][0-9]{0,17})(\\.[0-9]{1,8})?$"},
    "source_sequence_start": {"type": "integer", "minimum": 0, "maximum": 9007199254740991}, "source_sequence_end": {"type": "integer", "minimum": 0, "maximum": 9007199254740991}, "watermark_sequence": {"type": "integer", "minimum": 0, "maximum": 9007199254740991},
    "quality": {"enum": ["NORMAL", "DEGRADED", "STALE", "GAP", "UNAVAILABLE", "RECOVERING"]}, "gap_start_sequence": {"type": ["integer", "null"], "minimum": 0, "maximum": 9007199254740991}, "gap_end_sequence": {"type": ["integer", "null"], "minimum": 0, "maximum": 9007199254740991},
    "partial": {"type": "boolean"}, "final": {"const": true}, "revision": {"const": 0}, "aggregation_policy_version": {"type": "string", "minLength": 1}, "content_checksum": {"type": "string", "pattern": "^[0-9a-f]{64}$"}
  },
  "allOf": [{"if": {"properties": {"quality": {"const": "GAP"}}}, "then": {"properties": {"gap_start_sequence": {"type": "integer", "minimum": 0, "maximum": 9007199254740991}, "gap_end_sequence": {"type": "integer", "minimum": 0, "maximum": 9007199254740991}, "partial": {"const": true}}}, "else": {"properties": {"gap_start_sequence": {"type": "null"}, "gap_end_sequence": {"type": "null"}}}}],
  "$defs": {"uuid": {"type": "string", "format": "uuid", "pattern": "^[0-9a-f-]{36}$"}, "time": {"type": "string", "format": "date-time", "pattern": "Z$"}, "positiveDecimal": {"type": "string", "pattern": "^(?=.*[1-9])(0|[1-9][0-9]{0,17})(\\.[0-9]{1,8})?$"}, "nonNegativeDecimal": {"type": "string", "pattern": "^(0|[1-9][0-9]{0,17})(\\.[0-9]{1,8})?$"}}
}
