{"event_id":"399de3de-04b6-559b-af50-886ae2b092a9","partition_key":"600000.XSHG","instrument_id":"600000.XSHG","exchange":"XSHG","calendar_id":"CN-A","calendar_version":"cal-v1","session_id":"am","trading_day":"2026-08-11","timeframe_seconds":60,"window_start":"2026-08-11T01:31:00Z","window_end":"2026-08-11T01:32:00Z","event_time":"2026-08-11T01:32:00Z","received_at":"2026-08-11T01:32:00.001Z","open":"10.01","high":"10.20","low":"10.00","close":"10.10","volume":800,"turnover":"8050.00","source_sequence_start":11,"source_sequence_end":20,"watermark_sequence":20,"quality":"GAP","gap_start_sequence":15,"gap_end_sequence":16,"partial":true,"final":true,"revision":0,"aggregation_policy_version":"bar-v1","content_checksum":"d235db714c7702581ef41c0a2e323d92f978ecba2ab754fdfe43a931c16e9198","provider":"SIM","session_open_at":"2026-08-11T01:30:00Z","session_close_at":"2026-08-11T03:30:00Z","allowed_lateness_ms":500,"watermark_event_time":"2026-08-11T01:32:00.500Z"}
