{"event_id":"d0beb232-9499-54c7-a8b8-f8929120bb80","partition_key":"600000.XSHG","instrument_id":"600000.XSHG","exchange":"XSHG","calendar_id":"CN-A","calendar_version":"cal-v1","session_id":"am","trading_day":"2026-08-11","timeframe_seconds":60,"window_start":"2026-08-11T01:30:00Z","window_end":"2026-08-11T01:31:00Z","event_time":"2026-08-11T01:31:00Z","received_at":"2026-08-11T01:31:00.001Z","open":"10.00","high":"10.10","low":"9.90","close":"10.01","volume":1000,"turnover":"10005.00","source_sequence_start":1,"source_sequence_end":10,"watermark_sequence":10,"quality":"NORMAL","gap_start_sequence":null,"gap_end_sequence":null,"partial":false,"final":true,"revision":0,"aggregation_policy_version":"bar-v1","content_checksum":"fd378204dd7303f892b754ce3fbe2c4044744d82ea4373e44e013fb8c4318b48","provider":"SIM","session_open_at":"2026-08-11T01:30:00Z","session_close_at":"2026-08-11T03:30:00Z","allowed_lateness_ms":500,"watermark_event_time":"2026-08-11T01:31:00.500Z"}
